[
  {
    "id": "the-man-who-mistook-his-wife-for-a-hat",
    "title": "The Man Who Mistook His Wife for a Hat",
    "subtitle": "And Other Clinical Tales",
    "author": "Oliver Sacks",
    "year": 1985,
    "category": "medical-body",
    "subcategory": "neurology-cases",
    "tags": [
      "neurology",
      "brain",
      "perception",
      "memory",
      "identity",
      "case-studies"
    ],
    "difficulty": "moderate",
    "read_time_min": 12,
    "why_it_matters": "It changed what a medical case could sound like. Sacks wrote about people with damaged brains as people first, and turned neurology into a way of asking what a self is actually made of.",
    "crux": {
      "headline": "A deficit is a window into how a self is built",
      "body": "Damage rarely removes a person. It removes one component and leaves the rest of the machinery running, which is why a brain that has lost recognition, or memory, or the sense of where its limbs are still produces someone recognisable. Read each case for two things at once: what stopped working, and what the person built around the gap. The second is where the medicine and the humanity meet."
    },
    "sparks": [
      {
        "id": "the-man-who-mistook-his-wife-for-a-hat-s01",
        "hook": "He could describe every feature of a face and still not know whose it was.",
        "insight": "Seeing is not one thing. A patient with visual agnosia can catalogue what is in front of him with real precision, listing angles, colours and textures, and still fail to assemble any of it into a face or a glove. The eyes work. The machinery that turns features into a meaningful whole does not. Recognition is a separate act performed on top of vision, so fast that you experience the two as one event. Watching them come apart is the only way most people ever learn they were two.",
        "why": "Vision runs through many specialised regions, and damage to the ones that bind features into objects leaves the raw signal intact. The dissociation shows up in many patients, not a single famous one.",
        "apply": "Describe an object out loud for one minute using only shapes, colours and edges, never its name. Notice how hard your brain fights to jump straight to the label.",
        "format": "single",
        "tags": [
          "perception",
          "agnosia",
          "vision"
        ]
      },
      {
        "id": "the-man-who-mistook-his-wife-for-a-hat-s02",
        "hook": "His memory stopped decades ago. He is still, unmistakably, someone.",
        "insight": "A man with severe amnesia can lose the ability to lay down anything new and live inside a permanent present, unable to say what happened an hour ago. Yet his humour, his skills, his manners and his moral reactions all survive intact. That combination is strange only if you assume a self is a stack of remembered events. Much of what other people recognise as you is carried somewhere else: in habits, in feeling, in the way you attend to a room.",
        "why": "Memory is several systems, and they fail separately. Recall for events can collapse while skill learning and emotional learning continue, which is why the person in front of you stays recognisable.",
        "apply": "Ask an older relative to show you something they can do rather than recall a date. Skill memory often outlasts names and years by a long way.",
        "format": "single",
        "tags": [
          "memory",
          "amnesia",
          "identity"
        ]
      },
      {
        "id": "the-man-who-mistook-his-wife-for-a-hat-s03",
        "hook": "You have a sense you have never named, and you notice it only by losing it.",
        "insight": "Your body reports its own position constantly. Receptors in muscles and joints tell your brain where your arm is without you looking, which is how you can touch your nose with your eyes shut. When that channel is destroyed, the body goes silent. One patient had to steer every movement by watching it, replacing an automatic sense with continuous conscious effort, and had to relearn sitting upright the way other people learn a language.",
        "why": "Position sense is a genuine sensory channel with its own nerve fibres. Vision can substitute for it partially, but only with constant attention, which is why the loss is exhausting rather than merely inconvenient.",
        "apply": "Standing near a wall, balance on one leg with your eyes open, then close them. The extra wobble is position sense working alone, without vision to correct it.",
        "format": "single",
        "tags": [
          "proprioception",
          "senses",
          "body"
        ]
      },
      {
        "id": "the-man-who-mistook-his-wife-for-a-hat-s04",
        "hook": "Neurology is trained to count what is missing. Some patients have too much.",
        "insight": "The standard clinical exam is a subtraction: strength lost, field lost, words lost. But brains also produce excesses, and those carry just as much information. Tics that arrive faster than intention. Memories that flood in unbidden. Smell or feeling turned up past the point of usefulness. An excess is harder to score on a form than an absence, so it tends to be under-recorded, and a person can be told nothing is wrong while something is loudly wrong.",
        "why": "The excess and deficit framing is Sacks arguing with his own field, not a lab finding. Clinical practice has partly moved his way, though measuring a surplus remains harder than measuring a loss.",
        "apply": "When you describe a symptom to a clinician, say what has increased as well as what has gone. Sensations that got louder are information too.",
        "format": "single",
        "tags": [
          "symptoms",
          "clinical-thinking"
        ]
      },
      {
        "id": "the-man-who-mistook-his-wife-for-a-hat-s05",
        "hook": "Treating the illness can feel like editing out part of the person.",
        "insight": "A man with Tourette syndrome found that his speed, his timing and much of his wit ran on the same current as his tics. Calming the tics calmed him, and he did not entirely want to be calmed. Working it out with his doctor took longer than writing a prescription, because the question was not only whether the drug worked but which version of himself he wanted to spend his week as. Effectiveness and acceptability are different measurements.",
        "why": "This is one case, and the trade-off does not generalise. It matters because it names something trials rarely capture: a treatment can succeed on the outcome measure and still cost the patient something they value.",
        "apply": "If a treatment changes how much you feel like yourself, say that out loud to whoever prescribed it. A trade-off can only be weighed once it has been named.",
        "format": "single",
        "tags": [
          "tourettes",
          "treatment",
          "identity"
        ]
      },
      {
        "id": "the-man-who-mistook-his-wife-for-a-hat-s06",
        "hook": "Four questions turn a list of symptoms into an actual portrait.",
        "insight": "Sacks reads every case the same way, and the method is learnable. He asks what has been lost, what is still intact, what has become excessive, and what the person has made of the whole situation. The first question is the only one a standard chart insists on. The other three are where the diagnosis stops being a category and starts being a description of someone, which is also where useful ideas about living with it come from.",
        "why": "Function, preservation and adaptation are separate axes. Recording only the loss produces a file that fits many patients and helps none of them in particular.",
        "apply": "Write your own health situation, or a relative's, as answers to those four questions on one page. Take the page to the next appointment.",
        "format": "carousel",
        "carousel": [
          {
            "step": 1,
            "title": "Name what is lost",
            "body": "State the missing function plainly and concretely: not weakness, but cannot climb the stairs without stopping. Concrete losses are testable and get followed up."
          },
          {
            "step": 2,
            "title": "Name what is preserved",
            "body": "List what still works normally. Preserved function narrows the diagnosis, and it is the raw material any workaround will have to be built from."
          },
          {
            "step": 3,
            "title": "Name what has increased",
            "body": "Record surpluses as well: pain, movement, sensation, sleep, appetite, intrusive memory. Excesses are easy to leave out because no form asks for them."
          },
          {
            "step": 4,
            "title": "Name the adaptation",
            "body": "Say what the person already does to cope. Clinicians can then build on a working strategy instead of replacing it with an unfamiliar one."
          }
        ],
        "tags": [
          "clinical-thinking",
          "appointments"
        ]
      },
      {
        "id": "the-man-who-mistook-his-wife-for-a-hat-s07",
        "hook": "The most astonishing story in the book is also the least verifiable.",
        "insight": "Sacks describes twins who exchanged enormous numbers with apparent pleasure, and he reports them as primes. It is the passage everyone remembers, and it was never tested under controlled conditions. Later commentators pointed out that a pair could produce impressive-looking numbers by other routes, and no one has reproduced the ability. Hold it as literature about human strangeness rather than as evidence about arithmetic in the brain, and the book loses nothing.",
        "why": "A single-observer clinical anecdote cannot separate a genuine ability from a plausible shortcut. Nothing here was replicated, and keeping that doubt attached is part of reading the book honestly.",